{
  "$schema": "https://json-schema.org/draft/2020-12/schema",
  "$id": "https://folio.local/schemas/types/scatter.schema.json",
  "title": "Folio Scatter Authoring Input",
  "type": "object",
  "additionalProperties": false,
  "required": [
    "schema_version",
    "kind",
    "title",
    "x_axis",
    "y_axis",
    "points"
  ],
  "allOf": [{"if":{"properties":{"canvas":{"const":"poster"}},"required":["canvas"]},"else":{"properties":{"height":{"maximum":720}}}}],
  "properties": {
    "schema_version": {
      "const": "3.0"
    },
    "kind": {
      "const": "scatter"
    },
    "title": {
      "$ref": "#/$defs/non-empty-string"
    },
    "x_axis": {
      "$ref": "#/$defs/axis"
    },
    "y_axis": {
      "$ref": "#/$defs/axis"
    },
    "points": {
      "type": "array",
      "minItems": 3,
      "maxItems": 14,
      "items": {
        "$ref": "#/$defs/point"
      }
    },
    "focus": {"$ref": "#/$defs/nullable-string"},
    "unit": {"type": ["string", "null"], "maxLength": 12},
    "locale": {"enum": ["en-US", "en-GB", "zh-CN", "zh-TW", null]},
    "source": {"type": ["string", "null"], "maxLength": 256},
    "value_format": {
      "type": "object",
      "additionalProperties": false,
      "properties": {
        "precision": {
          "type": "integer",
          "minimum": 0,
          "maximum": 4
        },
        "compact": {
          "type": "boolean"
        },
        "grouping": {
          "type": "boolean"
        },
        "unit_position": {
          "enum": [
            "auto",
            "prefix",
            "suffix"
          ]
        }
      }
    },
    "canvas": {"enum": ["figure", "poster"]},
    "width": {
      "const": 960
    },
    "height": {"type": "integer", "minimum": 400, "maximum": 2400, "multipleOf": 4},
    "language": {"$ref": "#/$defs/nullable-string"}
  },
  "$defs": {
    "nullable-string": {"oneOf": [{"type": "null"}, {"$ref": "#/$defs/non-empty-string"}]},
    "non-empty-string": {
      "type": "string",
      "pattern": ".*\\S.*"
    },
    "axis": {
      "type": "object",
      "additionalProperties": false,
      "required": [
        "label"
      ],
      "properties": {
        "label": {
          "$ref": "#/$defs/non-empty-string"
        },
        "unit": {
          "type": "string",
          "maxLength": 12
        },
        "include_zero": {
          "type": "boolean"
        }
      }
    },
    "point": {
      "type": "object",
      "additionalProperties": false,
      "required": [
        "id",
        "label",
        "x",
        "y"
      ],
      "properties": {
        "id": {
          "$ref": "#/$defs/non-empty-string"
        },
        "label": {
          "$ref": "#/$defs/non-empty-string"
        },
        "x": {
          "type": "number"
        },
        "y": {
          "type": "number"
        },
        "emphasis": {
          "enum": [
            "focal",
            "normal"
          ]
        }
      }
    }
  }
}
