{
  "schema_version": "3.0",
  "kind": "scatter",
  "title": "Untitled Scatter",
  "x_axis": {
    "label": "X axis"
  },
  "y_axis": {
    "label": "Y axis"
  },
  "points": [
    {
      "id": "a",
      "label": "A",
      "x": 1,
      "y": 2
    },
    {
      "id": "b",
      "label": "B",
      "x": 3,
      "y": 4
    },
    {
      "id": "c",
      "label": "C",
      "x": 5,
      "y": 3
    }
  ]
}
